,listing_id,id,date,reviewer_id,reviewer_name,comments,review_lang,t_comments
720,2931870,17479891,2014-08-12,19292009,Alejandrina, Nuestra. estancia. fue. buena. Sus. propietarios. furon. muy. agradables. con. nosotras. asi. como. sus. mascotas. Como. inconveniente. la. localizaci. n. de. la. vivienda. ya. que. para. llegar. al. centro. nos. supon. a. coger. un. autob. s. el. 31. y. el. metro. la. linea. naranja. ,es,Our.stay.it was.good.Hers.OwnersFuron.very.Nicewith.we.So.What.their.pets.As. Inconveniencethe.locationn.from.the.living place.already.that.for.arrive.to the.center.us.Suponto.take.a.buss.the.31. And.the.meter.the.line.Orange.
721,2931870,19448456,2014-09-12,7700022,Elodie," Des. h. tes. d. exceptions. , Une. grande. chambre. avec. salle. de. bain. priv. e. , Merci. pour. cet. accueil. , ",fr,"From.h.your.d.Exceptions., A.big.bedroom.with.room.of.bath.private.e., Thank you.for.this.homepage.,"
722,2931870,32352612,2015-05-17,30704202,Brit, Vi. f. lte. os. meget. velkommen. da. vi. ankom. Cynthia. og. hendes. familie. kendte. vores. navne. en. meget. venlig. rundvisning. af. v. relse. k. kken. og. stue. Cynthia. og. hendes. mand. var. meget. opm. rksom. p. hvad. vi. fortrak. til. morgen. s. der. var. masser. af. frisk. brygget. kaffe. og. frugt. mm. beliggenheden. i. forhold. til. Boston. var. perfekt. hvor. vi. tilbragte. dagene. vi. fik. gode. tips. til. hvad. der. var. v. rd. at. se. i. Boston. ,da,We.f. LTE.U.S.much.Welcome.as.we.arrived.Cynthia.and.her.family.knew.our.names.one.much.friendly.Tour.of.v. Serification.k. KKE.and.living room.Cynthia.and.her.male.was.much.OPM.RKSOM.p. What.we.Forge.to.morning.s. There.was.Lots.of.fresh.Brewed.coffee.and.fruit.mm.The location.relative.to.Boston.was.perfect.where.we.spent.the days.we.got.excellent.tips.to.what.there.was.v. rd.to.see.in. Boston.
723,7988755,49138438,2015-10-01,2611092,Josué Isaías, Me. encant. el. lugar. es. precioso. cerca. del. centro. de. Boston. Sarah. nos. hizo. sentir. como. en. casa. Fue. muy. agradable. convivir. con. Sarah. ,es,I.Eventhe.place.is.precious.near.of.center.from.Boston.Sarahus.made.feel.What.in.House.It was.very.nice.live together.with.Sarah
724,7988755,51753743,2015-10-24,17041499,Michel," Bonsoir. Sarah. , Nous. venons. vous. remercier. pour. l. agr. able. s. jour. que. nous. avons. pass. chez. vous. Vous. nous. avez. tr. s. bien. re. us. , Merci. pour. votre. gentillesse. et. pour. toutes. les. info. utiles. notre. visite. de. Boston. , Bien. s. r. nous. ne. manquerons. de. vous. recommander. aupr. s. des. personnes. susceptibles. de. se. rendre. Boston. , Encore. merci. , V. ronique. et. Michel",fr,"Good evening.Sarah., We.VENON.you.to thank.for.L.AGR.Able.s.day.than.we.have.Pass.at the house of.you.You.we.have.tr.s.Good.D.US., Thank you.for.your.kindness.and.for.all.the.info.useful.our.visit.of.Boston., Good.s.r.we.born.Missing.of.you.recommend.AUPR.s.from.people.susceptible.of.SE.return.Boston., Again.thank you., Ronic V..and.Michel"
725,7988755,59524442,2016-01-11,12146719,Magalachmy," Le. logement. est. l. image. de. la. description. proche. du. m. tro. et. tr. s. agr. able. Sarah. est. une. h. te. tr. s. appr. ciable. , Je. recommande. vivement. ce. logement. quelconque. personne. voulant. visiter. Boston. ",fr,"The.lodging.is.L.picture.of.the.description.close.from.m.Tro.and.tr.s.AGR.Able.Sarah.is.a.h.you.tr.s.appr.cable., I.recommended.strongly.this.lodging.any.anybody.Wanting.to visit.Boston."
726,7988755,81820105,2016-06-25,16560318,Mathilde, Super. s. jour. Boston. Je. ne. connaissais. pas. du. tout. cette. ville. et. tait. venu. juste. pour. visiter. les. universit. s. mais. finalement. le. freedom. Trail. fut. beaucoup. plus. int. ressant. et. permet. de. faire. d. couvrir. la. ville. On. tait. super. bien. document. e. j. avais. lu. beaucoup. de. blog. et. guide. mais. surtout. Sarah. nous. as. laisser. plein. de. documentation. l. appartement. ce. que. j. ai. beaucoup. appr. cier. ,fr,Great.s.day.Boston.I.born.knew.not.from.all.this.city.and.tait.came.correct.for.to visit.the.University.s.corn.ultimately.the.Freedom.Trail.was.many.more.int.Feeling.and.allow.of.To do.d.cover.the.city.We.tait.Great.Good.document.e.j.had.read.many.of.Blog.and.guide.corn.above all.Sarah.we.AS.let.full.of.documentation.L.apartment.this.than.j.have.many.appr..
727,7988755,88154749,2016-07-23,42699217,Pascal," Bon. accueil. de. Sarah. qui. parle. fran. ais. et. fournit. de. bons. renseignements. et. une. carte. du. m. tro. de. Boston. , Le. logement. est. agr. able. grande. chambre. salle. de. bain. privative. terrasse. et. possibilit. de. se. faire. le. petit. d. jeuner. , Logement. dans. South. Boston. quartier. irlandais. proximit. du. m. tro. donc. pratique. pour. visiter. la. ville. de. Boston. et. Harvard. ",fr,"Good.homepage.of.Sarah.Who.speak.FRAN.AIS.and.Provides.of.good.information.and.a.card.from.m.Tro.of.Boston., The.lodging.is.AGR.Able.big.bedroom.room.of.bath.Private.Terrace.and.POSSIBILIT.of.SE.To do.the.small.d.fast., Lodging.in.South.Boston.piece.Irish.Proximity.from.m.Tro.so.convenient.for.to visit.the.city.of.Boston.and.Harvard."
728,7988755,89098925,2016-07-26,39418282,Helen, . ,zh-cn,.
729,7988755,90290225,2016-07-31,67074611,Béatrice," Le. logement. de. Sarah. correspondait. notre. attente. Nous. n. avons. pas. t. d. u. Nous. avons. t. bien. accueilli. Sarah. est. tr. s. sympathique. un. petit. d. jeuner. nous. a. m. me. t. offert. Le. logement. est. tr. s. bien. situ. m. tro. tr. s. proche. pour. regagner. le. centre. ville. Une. adresse. recommander. nos. amis. qui. souhaitent. se. rendre. Boston. , Encore. merci. Sarah. pour. son. accueil. ",fr,"The.lodging.of.Sarah.corresponded.our.waiting.We.not.have.not.t.d.u.We.have.t.Good.welcome.Sarah.is.tr.s.friendly.a.small.d.fast.we.at.m.me.t.Free.The.lodging.is.tr.s.Good.if you.m.Tro.tr.s.close.for.Return.the.center.city.A.address.recommend.NOS.friends.Who.wish.SE.return.Boston., Again.thank you.Sarah.for.his.homepage."
730,5953696,66923597,2016-03-25,7064606,Charlotte, Fantastisk. ophold. Kierstyn. var. s. s. d. hj. lpsom. og. im. dekommende. og. lejligheden. var. s. smuk. og. ren. Den. ligger. perfekt. midt. i. Boston. downtown. lige. overfor. Macys. og. i. g. afstand. til. det. meste. meget. t. t. p. metroen. Kierstyn. havde. lagt. nogle. rigtig. gode. anbefalinger. klar. til. os. da. vi. ankom. Det. eneste. minus. ved. vores. v. relse. var. at. det. var. meget. varmt. men. Kierstyn. havde. p. forh. nd. gjort. en. fane. klar. til. nedk. ling. Hvis. du. skal. til. Boston. kan. denne. lejlighed. virkelig. anbefales. ,da,Fantastic.stay.Kierstyn.was.s. p. d. Hj.LPSOM.and.IM.Declash.and.the apartment.was.s. Beautiful.and.clean.The.lies.perfect.in the middle.in. Boston.downtown.just.transfer.Macys.and.in. g. distance.to.that.most.much.t. t. p. The subway.Kierstyn.had.laid.some.correct.excellent.Recommendations.clear.to.U.S.as.we.arrived.That.only.minus.by.our.v. Serification.was.to.that.was.much.hot.but.Kierstyn.had.p. Prevy.nd.done.one.tab.clear.to.down.ling.If.you.shall.to.Boston.able to.this.apartment.really.Recommended.
731,6742905,37999286,2015-07-12,6870904,Valentina, Una. location. da. 5. stelle. un. host. molto. gentile. ceck. in. rapido. per. l. appartamento. andrebbe. un. pochino. rinnovato. ,it,A.Location.from.5 stars.a.Host.very.Kind.Check.in.quick.for.L.apartment.It would go.a.a little.Renovated.
732,6742905,41958900,2015-08-10,6071049,Maria, . ,ru,.
733,6742905,51427132,2015-10-20,22852040,Anke, Sean. hat. von. Beginn. an. sehr. zuverl. ssig. geantwortet. Auch. die. Schl. ssel. bergabe. ber. einen. Schl. sselsafe. funktionierte. problemlos. Die. Wohnung. ist. innerhalb. Bostons. hervorrragend. gelegen. so. dass. die. Stadt. problemlos. zu. Fu. zu. erkunden. ist. Leider. entspricht. der. Standard. der. Wohnung. nicht. den. ver. ffentlichten. Bildern. und. wir. waren. sehr. berrascht. ber. die. hervorrageden. Bewertungen. dieser. Wohnung. Die. Wohnung. war. nicht. nur. alt. sondern. insgesamt. schmutzig. und. schmuddelig. Erreicht. werden. konnte. sie. ber. ein. v. llig. verschmutztes. Treppenhaus. Die. Einrichtung. war. teilweise. kaputt. es. fehlte. an. allen. Grundlagen. die. eine. Wohnung. ben. tigt. keine. Kaffeemaschine. kein. Wasserkocher. kein. einziges. Glas. im. Schrank. Wasser. stand. nach. kurzem. Duschen. in. der. Wanne. zugige. Fenster. dauerhaft. piepender. Rauchmelder. im. Treppenhaus. Handt. cher. alt. und. verf. rbt. ,de,Sean.has.from.Beginning.on.very.Reliable.SSSIG.answered.Also.the.Schl.SSEL.Default.Ber. One.Schl.Ssersafe.worked.easy.The.Apartment.is.inside.Bostons.Outstanding.located.so.that the.City.easy.to.FU.to.explore.is.Unfortunately.is equivalent to.the.Default.the.Apartment.not.the.Ver. published.Pictures.and.weather.was.very.Borrowing.Ber. The.Excellent.Reviews.this.Apartment.The.Apartment.was.not.only.old.but.all in all.dirty.and.scruffy.Achieved.will.could.she.on.v.Lig.Soiled.Staircase.The.Furnishings.was.partial.broken.it.missed.on.Allen.Basics.the.one.Apartment.Ben.Office.none.Coffee machine.no.Water heater.no.Only.Glass.in the.Wardrobe.Water.was standing.after.Short.Take a shower.in the.Tub.Trap.Window.continuous.Biepender.Smoke detector.in the.Staircase.Hand.Cher.old.and.Author.RBT.
734,6742905,56777642,2015-12-18,21999314,Ignacio," La. descripci. n. del. anuncio. era. correcta. y. Sean. aclar. en. un. mail. con. las. indicaciones. para. encontrar. el. departamento. que. la. limpieza. se. hac. a. despu. s. de. llegar. y. no. antes. Esto. podr. a. ser. un. inconveniente. para. algunas. personas. pero. no. es. mi. caso. , La. ubicaci. n. del. departamento. es. sin. dudas. uno. de. sus. mayores. atractivos. Est. a. menos. de. 5. minutos. de. la. linea. roja. del. metro. en. uno. de. los. barrios. m. s. lindos. de. Boston. y. con. todo. lo. que. uno. necesite. cerca. Tambi. n. hay. que. se. alar. que. todo. en. el. departamento. funciona. bien. ducha. cocina. wifi. etc. Por. ltimo. el. departamento. ten. a. una. plancha. cosa. que. me. result. muy. til. ya. que. estaba. viajando. por. negocios. ",es,"The.Descriptionn.of.advertisement.it was.Right.Y.Be.Record.in.a.Mail.with.the.indications.for.meet.the.Department.that.the.cleaning.I know.HAC.to.afters.from.arrive.Y.no.before.This.Could.to.to be.a.inconvenient.for.some.persons.but.no.is.me.case., The.locationn.of.Department.is.without.Doubts.one.from.their.greater.AttractionsIs.less.from.5 minutes.from.the.line.Redof.meter.in.one.from.the.neighborhoods.m.s.Lindosfrom.Boston.Y.with.everything.it.that.one.Need.near.Tambin.there are.that.I know.Alar.that.everything.in.the.Department.it works.good.shower.kitchen.Wifi.etc.For.LTthe.Department.have.to.a.iron.thing.that.I.Resultvery.Til.already.that.I was.Travelingfor.business."
735,6742905,70723880,2016-04-20,35542772,Freek, Sean. heb. ik. niet. ontmoet. We. hebben. enkel. contact. gehad. voordat. ik. arriveerde. De. procedure. van. het. arriveren. heeft. hij. duidelijk. beschreven. toch. bleek. dat. de. woning. niet. op. Irving. st. is. maar. Philips. st. Dit. vond. ik. een. beetje. raar. ,nl,Sean.have got.I.not.meet.We.to have.single.Contact.Had.before.I.Arrived.The.procedure.by.the.arrive.has.he.clear.described.However.pale.Which.the.home.not.on.Irving.st.is.but.Philips.st.This.found.I.a.bit.weird.
736,6742905,70953921,2016-04-22,46372287,Lilian," La. ubicaci. n. muy. buena. , La. comunicaci. n. con. el. anfitri. n. y. acceso. correcta. a. pesar. que. tuvimos. que. subir. dos. piso. por. escalera. con. el. equipaje. , Faltaban. detalles. de. presentaci. n. para. sentirnos. completamente. c. modos. ",es,"The.locationn.very.good., The.communicationn.with.the.Anfitrin.Y.access.Right.to.weigh.that.We had.that.go up.two.floor.for.stairs.with.the.Baggage., They were missing.details.from.presentationn.for.Feel uscompletely.c.Modes"
737,6742905,71180368,2016-04-24,43307209,Agustina, Si. bien. no. hemos. tenido. la. posibilidad. de. conocer. en. persona. a. Sean. l. ha. sido. muy. claro. con. las. instrucciones. y. siempre. ha. contestado. rapid. simos. nuestros. mensajes. El. departamento. esta. ubicado. en. un. lugar. estrat. gico. el. barrio. es. hermoso. y. muy. seguro. Solo. hemos. dormido. en. el. departamento. ya. que. durante. el. d. a. est. bamos. recorriendo. ,es,Yes.good.no.we have.Dyed.the.possibility.from.know.in.person.to.Be.l.he has.been.very.Clear.with.the.instructions.Y.forever.it has.answeredRapidSimosour.posts.The Department.is.located.in.a.place.StratessGICO.the.neighborhood.is.handsome.Y.very.sure.Only.we have.slept.in.the.Department.already.that.during.the.d.to.its T.let's go.Touring.
738,6742905,74100854,2016-05-13,44330323,Gustavo," El. departamento. estaba. limpio. y. tal. cual. se. ve. en. las. fotos. Causa. un. poco. de. impresion. el. desnivel. del. piso. pero. no. genera. inconvenientes. y. te. acostumbras. r. pido. El. barrio. es. verdaderamente. hermoso. Todo. sali. de. acuerdo. a. lo. planeado. , ",es,"The Department.I was.cleansed.Y.such.which.I know.go.in.the.Photos.Cause.a.little bit.from.Print.the.Spellingof.floor.but.no.generate.DisadvantagesY.tea.You are customary.r.I ask.The neighborhood.is.truly.handsome.Everything.I left.from.agreement.to.it.planned,"
739,6742905,77547533,2016-06-01,43794474,Lorena," El. departamento. en. el. que. alojamos. no. era. este. que. es. el. que. habiamos. reservado. sino. otro. que. tiene. tambien. publicado. por. la. zona. El. cambio. se. realiz. sin. que. se. nos. consultar. solo. se. nos. notific. pero. bueno. era. una. noche. y. decidi. no. discutir. , Estaba. bien. para. 1. noche. o. una. estadia. muy. corta. no. m. s. tiempo. , Si. bien. deb. a. haber. elementos. b. sicos. tal. como. dice. la. publicaci. n. eramos. 2. huespedes. pero. s. lo. hab. a. un. nico. toall. n. para. ambos. y. ninguna. toalla. de. mano. y. la. limpieza. del. ba. o. era. un. tanto. deficiente. , Si. bien. Sean. demor. en. responder. nuestras. consultas. y. lo. conocimos. s. lo. por. casualidad. las. indicaciones. para. entrar. en. el. depto. fueron. claras. y. concisas. y. en. tiempo. y. forma. , Ahora. bien. siendo. el. check. out. al. mediod. a. uno. entiende. que. estando. el. departamento. ocupado. el. propietario. se. encarga. de. avisarle. a. los. huespedes. que. siguen. que. no. pueden. ingresar. antes. o. que. al. menos. ir. a. verificar. si. uno. ya. se. retir. para. poder. adelantar. el. check. in. de. los. que. siguen. pero. no. No. eran. ni. las. 11am. cuando. alguien. empezaba. a. abrir. la. puerta. del. departamento. al. pedir. que. aguarden. porque. nos. estabamos. vistiendo. y. salir. a. verificar. eran. los. huespedes. que. seguian. entrando. en. el. departamento. sin. que. nosotros. nos. hubiesemos. ido. a. n. , No. es. culpa. ni. responsabilidad. de. ellos. que. les. explicamos. la. situaci. n. y. les. pedimos. que. esperaran. afuera. mientras. nos. apurabamos. para. poder. irnos. antes. ya. que. la. situaci. n. se. habia. vuelto. incomoda. con. gente. desconocida. llena. de. valijas. esperando. del. otro. lado. de. la. puerta. Nos. pareci. desorganizado. y. una. falta. de. respeto. para. nosotros. y. para. ellos. tambien. por. parte. del. propietario. , Nosotros. nos. fuimos. pidiendoles. disculpas. como. si. fuera. nuestra. culpa. porque. logicamente. el. departamento. no. iba. a. estar. ni. limpio. ni. con. toallas. porque. no. habia. mas. que. una. y. la. habiamos. usado. , Esperamos. unos. d. as. a. ver. si. el. due. o. nos. contactaba. para. pedirnos. disculpas. por. lo. ocurrido. pero. no. no. supimos. mas. nada. de. l. ",es,"The Department. in. the. that. We stayed. no. it was. this. that. is. the. that. We had. reserved. otherwise. other. that. has. too. published. for. the. zone. The change. I know. Estate. without. that. I know. us. Consult. only. I know. us. Notific but. Okay. it was. a. night. Y. I decided. no. argue. , I was. good. for. 1. Night or. a. stay. very. short. no. m. s. weather. , Yes. good. Deb to. to have. elements. b. Sicos. such. What. He says. the. Publication n. We were. 2. Guests. but. s. it. Hab. to. a. Nico. Toll. n. for. both of them. Y. none. towel. from. hand. Y. the. cleaning. of. BA. or. it was. a. so much. deficient. , Yes. good. Be. Demor in. reply. ours Consultations Y. it. We met. s. it. for. chance. the. indications. for. get in. in. the. Dept. They were. Clear Y. concise Y. in. weather. Y. shape. , Now. good. being. the. Check out. to the. half D. to. one. understands. that. Being. the. Department. occupied. the. owner. I know. Order. from. Notify you to. the. Guests. that. They continue. that. no. may. get into. before. or. that. to the. less. go. to. check. Yes. one. already. I know. withdrawn for. can. advance. the. Check In. from. the. that. They continue. but. no. They were not. neither. the. 11am. when. someone. It started. to. to open. the. door. of. Department. to the. ask. that. Aguarden. because. us. We were. wearing. Y. get out. to. check. were. the. Guests. that. They followed. entering. in. the. Department. without. that. us. us. We would have. gone. to. n. , Is not. guilt. neither. responsibility. from. they. that. them. We explain. the. situation n. Y. them. We ask. that. They waited. outside. While. us. We hurried. for. can. go before. already. that. the. situation n. I know. there were. turned. Uncomfortable. with. people. Unknown full. from. luggage. waiting. of. other. side. from. the. door. We looked like. disorganized. Y. a. lack. from. I respect. for. us. Y. for. they. too. for. part. of. owner. , Us. us. went. Ask them. Apologies What. Yes. out of. our. guilt. because. Logically. the. Department. no. I was going. to. be. neither. cleansed. neither. with. towels. because. no. there were. more. that. a. Y. the. We had. used. , We wait. some. d. ace. to. see. Yes. the. Due or. us. Contact. for. Ask us Apologies for. it. Estared but. no. no. We knew. more. any. from. l."
740,6742905,80377518,2016-06-17,2930153,Ruben," La. ubicaci. n. del. apartamento. es. muy. buena. en. un. barrio. t. pico. y. muy. bonito. de. Boston. y. cerca. de. todo. pero. nuestra. experiencia. con. el. apartamento. de. Sean. fue. muy. mala. , El. fue. muy. claro. en. su. explicaci. n. de. como. llegar. al. apartamento. y. de. como. retirar. la. llave. de. un. locker. a. la. vuelta. de. la. esquina. , Nunca. hubo. contacto. personal. con. Sean. solo. por. mail. es. l. gico. ya. que. si. lo. hubi. ramos. visto. personalmente. nos. hubi. ramos. quejado. La. primera. desilusi. n. fue. al. entrar. al. edificio. el. apartamento. en. un. tercer. piso. con. escalera. angosta. alfombrada. y. muy. sucia. Las. fotos. del. apartamento. son. viejas. y. no. muestran. su. estado. actual. que. es. muy. malo. En. las. fotos. se. ve. un. apartamento. peque. o. sencillo. pero. aceptable. por. el. precio. y. nos. equivocamos. buscamos. otro. lugar. cercano. para. alojarnos. pero. not. encontramos. otro. alojamiento. , El. closet. esta. ocupado. por. maderas. viejas. lata. de. pinturas. persiana. rota. y. cama. desarmada. por. lo. cual. nuestra. ropa. quedo. en. las. maletas. Una. de. las. ventanas. no. tiene. la. persiana. americana. en. la. foto. ventana. izquierda. Paredes. y. techo. desparejos. y. mal. pintados. Puerta. del. bajo. mesada. rota. el. piso. del. ba. o. desnivelado. y. con. baldosas. flojas. faltaba. una. toalla. de. mano. que. reclamamos. a. Sean. y. nunca. trajo. En. la. cama. hab. a. una. sola. sabana. y. un. edredon. que. no. sabemos. si. estaba. limpio. En. la. heladera. comida. vieja. y. vencida. La. limpieza. no. era. buena. el. microondas. engrasado. Por. algo. Sean. nos. escribi. textualmente. por. mail. Please. don. t. complain. to. Airbnb. and. please. do. not. get. cranky. with. me. that. the. place. isn. t. clean. if. you. get. in. early. Most. people. aren. t. cranky. and. I. thank. you. in. advance. for. not. being. cranky. aclaramos. que. nosotros. no. somos. obsesivos. por. la. limpieza. y. el. check. in. fue. a. las. 2. PM. , Lo. nico. bueno. es. la. ducha. con. abundante. caudal. de. agua. y. temperatura. , ",es,"The. location n. of. apartment. is. very. good. in. a. neighborhood. t. peak. Y. very. beautiful. from. Boston. Y. near. from. everything. but. our. experience. with. the. apartment. from. Be. it was. very. bad. , He was. very. Clear. in. his. explanation n. from. What. arrive. to the. apartment. Y. from. What. remove. the. wrench. from. a. Locker to. the. return. from. the. corner. , Never. was. Contact. personal. with. Be. only. for. Mail. is. l. GICO. already. that. Yes. it. HUBI Ramos viewed. personally. us. HUBI Ramos Complained The. first. Desilusi n. it was. to the. get in. to the. edifice. the. apartment. in. a. third. floor. with. stairs. Narrow Carpeted Y. very. dirty. The. Photos. of. apartment. are. Old Y. no. They show. his. condition. current. that. is. very. bad. In. the. Photos. I know. go. a. apartment. small or. simple. but. acceptable. for. the. price. Y. us. We are wrong. We look for. other. place. near. for. Stay. but. Not. we find. other. accommodation. , The closet. is. occupied. for. Wood Old can. from. Paintings. blind. broken. Y. bed. Unarmed for. it. which. our. clothing. I remain. in. the. suitcases. A. from. the. Windows. no. has. the. blind. American in. the. Photo. window. left. Walls. Y. ceiling. Unpared. Y. evil. painted Door. of. under. Messada. broken. the. floor. of. BA. or. uneven Y. with. tiles Loose I was missing. a. towel. from. hand. that. we claim. to. Be. Y. never. He brought. In. the. bed. Hab. to. a. alone. bed sheet. Y. a. quilt. that. no. we know. Yes. I was. cleansed. In. the. refrigerator. meal. old. Y. defeated The. cleaning. no. it was. good. the. microwave oven. greased. For. something. Be. us. I wrote. Textually. for. Mail. Por favor. Don. t. Complain. To. Airbnb. and. por favor. do. Not. Get Cranky with. I. That. The. Place. ISN t. Clean If You Get In. Early. MOST People Aren t. Cranky and. I. THANK. You In. Advance. For. Not. Being. Cranky We clarify. that. us. no. are. obsessive for. the. cleaning. Y. the. Check In. it was. to. the. 2. pm , It. Nico. Okay. is. the. shower. with. abundant. flow. from. Water. Y. temperature. ,"
741,6742905,86848174,2016-07-17,67479895,Lindsey, D,de,D
742,6742905,88590020,2016-07-24,5345607,Martine," L. appartement. ne. ressemble. en. rien. aux. photos. c. est. v. tuste. et. sale. la. penderie. est. encombree. de. vieux. morceaux. de. bois. et. autres. horreurs. la. vieille. vaisselle. est. sortie. les. placards. et. tiroirs. encombres. de. choses. diverses. entam. es. et. sales. il. y. a. dans. le. frigo. du. beurre. des. conserves. et. de. l. eau. le. tout. entame. l. clairage. cuisine. est. HS. les. draps. et. la. housse. sont. troues. comme. les. rideaux. pas. de. store. sur. une. fenetre. la. salle. de. bains. peu. accessible. est. v. tuste. et. l. armoire. moisie. et. encombr. e. de. vieux. savons. usages. le. tub. est. v. tuste. On. n. a. pas. eu. envie. de. cuisiner. ni. meme. se. faire. un. cafe. Une. horreur. a. fuir. absolument. Le. propri. taire. trouve. que. pour. le. prix. tout. est. normal. , UNE. HONTE. ",fr,"L. apartment.born.looks like.in.nothing.to.Pictures.vs.is.v.TUSTE.and.dirty.the.wardrobe.is.encloche.of.old.parts.of.drink.and.others.horrors.the.old.washing up.is.exit.the.cupboards.and.drawers.enclosures.of.things.Various.ENTAM.es.and.Dirty.he.y.at.in.the.fridge.from.butter.from.canned.and.of.L.water.the.all.start.L.Fleery.food.is.HS.the.Sheets.and.the.Cover.are.holes.like.the.drapes.not.of.Store.on.a.window.the.room.of.baths.little.accessible.is.v.TUSTE.and.L.cabinet.moldy.and.cog.e.of.old.Soaps.Uses.the.Tub.is.v.TUSTE.We.not.at.not.EU.desire.of.to cook.or.even.SE.To do.a.Coffee.A.horror.at.to flee.absoutely.The.Property.to hush up.find.than.for.the.price.all.is.normal., A.SHAME."
743,8439372,57350423,2015-12-24,16805556,Julie, Bel. appartement. propre. et. fonctionnel. bien. situ. 10. minutes. de. marche. de. la. station. de. metro. et. relativement. proche. du. centre. ville. L. h. te. s. est. montr. e. tr. s. disponible. et. a. r. pondu. tr. s. rapidement. un. probl. me. d. eau. chaude. et. de. temp. rature. de. l. appartement. Le. lendemain. tout. tait. r. gl. Le. seul. probl. me. que. nous. avons. rencontr. et. qui. a. t. ennuyant. durant. notre. s. jour. tait. l. absence. de. place. de. parking. Nous. avons. d. en. chercher. une. dans. un. parking. publique. et. cela. revenait. 40. dollar. jour. Appartement. recommander. Merci. ,fr,Beltapartment.own.and.functional.Good.if you.10. Minutes.of.market.of.the.station.of.Metro.and.relatively.close.from.center.city.L. h.you.s.is.show.e.tr.s.available.and.at.r.Pondu.tr.s.quickly.a.problem.me.d.water.Hot.and.of.TEMP.RATE.of.L.apartment.The.the following day.all.tait.r.GL.The.alone.problem.me.than.we.have.met.and.Who.at.t.annoying.during.our.s.day.tait.L.absence.of.square.of.car park.We.have.d.in.to look for.a.in.a.car park.public.and.that.returned.40. Dollar.day.Apartment.recommend.Thank you.
744,7933149,59216404,2016-01-08,47956825,Adrien," Syst. me. d. auberge. avec. chambres. priv. e. et. salle. de. bain. commune. 6sdb. pour. 12chambres. Tr. s. bonne. organisation. pour. l. arriv. e. et. le. d. part. R. sidence. tr. s. propre. cuisine. commune. tr. s. bien. quip. e. Chauffage. un. peu. bruyant. et. tr. s. puissant. , Appartement. a. 10metres. du. m. tro. Seul. b. mol. la. photo. ne. correspond. pas. la. chambre. qui. est. plus. petite. ",fr,"System.me.d.hostel.with.bedrooms.private.e.and.room.of.bath.common.6SDB.for.12 rooms.Tr. S.good.organization.for.L.arrivals.e.and.the.d.go.A. SIDE.tr.s.own.food.common.tr.s.Good.who P.e.Heater.a.little.noisy.and.tr.s.powerful., Apartment.at.10metres.from.m.Tro.Only.b.mol.the.Photo.born.corresponds.not.the.bedroom.Who.is.more.small."
745,7933149,61003020,2016-01-30,29364585,Xueying, great. ,ro,great.
