,listing_id,id,date,reviewer_id,reviewer_name,comments,review_lang,t_comments
501,3890373,77959255,2016-06-04,27427793,Pamela," Excelente. estad. a. en. el. departamento. de. Paul. Absolutamente. recomendable. la. ubicaci. n. cerca. de. todo. tren. supermercado. bares. y. restaurantes. El. barrio. es. incre. ble. muy. cl. sico. de. Boston. y. a. corta. distancia. a. pie. de. varios. puntos. de. inter. s. , El. apartamento. es. precioso. con. muchos. detalles. impecable. y. con. una. decoraci. n. destacable. Alojamos. un. grupo. de. 4. personas. y. no. tuvimos. problemas. con. el. espacio. ni. con. la. comodidad. , Por. ltimo. Paul. es. un. gran. anfitri. n. muy. preocupado. y. atento. Gracias. por. todo. y. esperamos. regresar. alg. n. d. a. , ",es,"Excellent.be.to.in.the.Department.from.PaulAbsolutely.recommendable.the.locationn.near.from.everything.train.Supermarket.pubs.Y.restaurants.The neighborhood.is.increaseBLEvery.cl.SICO.from.Boston.Y.to.short.distance.to.foot.from.various.points.from.inter.s., Apartment.is.precious.with.Many.details.impeccable.Y.with.a.decorationn.remarkableWe stayed.a.group.from.4 people.Y.no.We had.problems.with.the.space.neither.with.the.comfort., For.LTPaulis.a.great.Anfitrin.very.worried.Y.attentive.Thank you.for.everything.Y.we wait.to get back.Alg.n.d.to.,"
502,3021446,39372481,2015-07-23,22961942,Aurélie & Michèle," J. tais. jusqu. pr. sent. tr. s. contente. de. mes. exp. riences. Airbnb. Celle. ci. fut. la. pire. On. a. vraiment. l. impression. de. d. ranger. en. particulier. nina. qui. dit. rarement. bonjour. Mike. est. juste. poli. Ils. ne. font. aucun. effort. pour. nous. accueillir. et. que. nous. aussi. on. se. sente. bien. Leur. appartement. n. est. pas. du. tout. fid. le. l. annonce. et. aux. commentaires. des. autres. voyageurs. Le. salon. et. la. cuisine. sont. sales. et. en. d. sordre. Nous. n. avons. pas. os. cuisiner. vu. l. tat. de. salet. des. plaques. de. cuisson. et. l. encombrement. pr. sent. autour. C. est. un. d. fi. de. r. ussir. s. asseoir. sur. le. canap. Il. est. recouvert. de. draps. de. protection. qui. ne. sont. pas. accueillants. car. le. chien. s. y. repose. et. Nina. y. est. r. guli. rement. allong. e. pour. regarder. ses. s. ries. , La. climatisation. tourne. fond. et. Nina. refuse. d. augmenter. la. temp. rature. ou. de. l. teindre. , L. appartement. est. tr. s. bruyant. Il. n. y. a. pas. de. rideaux. pour. la. lumi. re. on. est. r. veill. d. s. 6. 00. du. matin. , La. seule. chose. fid. le. la. description. est. la. proximit. des. transports. en. commun. , Bref. le. meilleur. moment. est. celui. o. on. quitte. ce. lieu. , , ",fr,"J. TAIS. up. pr. feel. tr. s. satisfied. of. my. EXP. Tools. Airbnb. That. this. was. the. worse. We. at. really. L. impression. of. d. tidy. in. particular. Nina. Who. said. rarely. Hello. Mike. is. correct. polished. They. born. make. any. effort. for. we. to welcome. and. than. we. Also. we. SE. Sente. Good. Their. apartment. not. is. not. from. all. FID. the. L. announcement. and. to. comments. from. others. Travelers. The. salon. and. the. food. are. Dirty. and. in. d. to sort. We. not. have. not. bone. to cook. seen. L. TAT. of. salet. from. Plates. of. Cooking. and. L. clutter. pr. feel. around. It is. a. d. Fi. of. r. USSIR. s. Sit. on. the. Canap. He. is. covered. of. Sheets. of. protection. Who. born. are. not. Welcoming. because. the. dog. s. y. rests. and. Nina. y. is. r. Guli. . ALLONG. e. for. to look at. his. s. . , The air conditioning. turned. fund. and. Nina. refuse. d. to augment. the. TEMP. RATE. Where. of. L. dye , L. apartment. is. tr. s. noisy. He. not. y. at. not. of. drapes. for. the. Lumi. D. we. is. r. EVILL. d. s. 6. 00. DU. morning. , The only. thing. FID. the. the. description. is. the. Proximity. from. Transport. in. commmon. , Short. the. better. moment. is. that's why I wrote to you. o. we. quits. this. place. , ,,"
503,3021446,40772755,2015-08-02,36928674,Susana, La. casa. est. muy. bien. situada. pr. xima. a. la. estaci. n. de. metro. y. en. una. zona. muy. tranquila. y. a. 5. estaciones. del. centro. de. Boston. La. habitaci. n. es. c. moda. y. el. ba. o. muy. amplio. y. exclusivo. para. los. invitados. Nina. nos. atendi. muy. bien. y. se. preocup. de. que. tuvi. ramos. todas. las. comodidades. ,es,The.House.its T.very.good.Located.PRXima.to.the.Stationn.from.meter.Y.in.a.zone.very.quiet.Y.to.5. Stations.of.center.from.Boston.The.habitationn.is.c.fashion.Y.the.BA.or.very.large.Y.exclusive.for.the.Guests.Girl.us.Atendivery.good.Y.I know.concernfrom.that.Tui.Ramosall.the.mod cons.
504,3021446,92656514,2016-08-09,23206795,Florence," Le. logement. etait. bien. decrit. Il. est. au. premier. etage. au. calme. et. a. deux. minutes. a. pied. du. metro. ligne. orange. station. Stony. Brooks. , Par. contre. la. climatisation. est. centrale. pour. tout. l. appartement. et. elle. se. declenche. regulierement. de. facon. bruyante. ",fr,"The.lodging.was.Good.describe.He.is.to.first.stage.to.calmed down.and.at.of them.minutes.at.foot.from.Metro.line.orange.station.Stony.Brooks., Through.vs.the.air conditioner.is.central.for.all.L.apartment.and.she.SE.sets off.regularly.of.way.noisy."
505,3905508,76641083,2016-05-28,7199113,Sandrine, Margaret. et. Bradley. sont. des. h. tes. fantastiques. Tr. s. amicaux. et. pr. venants. ,fr,Margaret.and.Bradley.are.from.h.your.Fantastic.Tr. S.Friends.and.pr.coming.
506,3905508,95787802,2016-08-21,3674962,Simone, Es. war. der. perfekte. Aufenthalt. eine. sch. ne. Wohnung. ein. sch. nes. Haus. ringsherum. Garten. Es. war. sehr. ruhig. auch. nachts. Magret. und. ihr. Mann. sind. perfekte. Gastgeber. Alles. lief. so. unkompliziert. es. war. einfach. toll. Bilder. und. Realit. t. sind. eins. Danke. ,de,It.was.the.Perfect.Stay.one.Sch.ne.Apartment.one.Sch.NES.House.All around.Garden.It.was.very.quiet.also.at night.Magret.and.her.Husband.are.Perfect.Host.Everything.ran.so.Uncomplicated.it.was.simple.Great.Photos.and.Realit.t.are.one.Thank you.
507,6436334,39469683,2015-07-23,39167620,Nadia, Tr. s. petite. chambre. dans. un. quartier. r. sidentiel. environ. 10. minutes. de. voiture. du. port. de. Boston. et. distance. de. marche. de. l. a. roport. excellent. d. jeuner. au. caf. d. c. t. aussi. tenu. par. Monica. ,fr,Tr. S.small.bedroom.in.a.piece.r.sidential.about.10. Minutes.of.car.from.Harbor.of.Boston.and.distance.of.market.of.L.at.ROPORT.excellent.d.fast.to.Caf.d.vs.t.Also.tenuous.through.Monica.
508,3968797,35608367,2015-06-20,21398423,Lucy, Jennifer. nice. peaceful. thoughtful. megabus. Jennifer. organic. Jennifer. Rowa. ,zh-cn,Jennifer. nice. peaceful. thoughtful. megabus. Jennifer. organic. Jennifer. Rowa.
509,3968797,42312758,2015-08-12,39123214,Xiaolin, . JENNIFER. ,zh-cn,. JENNIFER.
510,3968797,91856804,2016-08-06,29643183,Cécile, Jennifer. est. adorable. et. nous. a. accueillis. malgr. notre. arriv. e. tardive. Sa. maison. est. dans. un. quartier. r. sidentiel. calme. ,fr,Jennifer.is.adorable.and.we.at.welcomed.Malga.our.arrivals.e.late.His home.is.in.a.piece.r.sidential.calmed down.
511,3968797,93939106,2016-08-14,68626828,Moritz, Jennifer. hat. uns. sehr. herzlich. aufgenommen. und. uns. sogar. sp. t. abends. von. der. U. Bahn. Haltestelle. abgeholt. Von. ihr. gab. es. wertvolle. Tipps. zur. Umgebung. Sie. gab. uns. jederzeit. das. Gef. hl. willkommen. zu. sein. Alles. in. allem. ein. u. erst. angenehmer. Aufenthalt. Wir. freuen. uns. schon. sehr. auf. das. n. chste. Mal. ,de,Jennifer.has.US.very.heartfelt.recorded.and.US.even.Sp.t.in the evening.from.the.Subway.Bus stop.picked up.From.her.gave.it.valuable.Tips.to the.Surroundings.She.gave.US.at any time.that. Gef. Hl.welcome.to.being.Everything.in particular.one.u. first. more pleasant.Stay.We.be happy.US.beautiful.very.on.That. N. Chste.Just.
512,7194793,49336203,2015-10-03,28006573,Julieta," Nuestra. estad. a. en. lo. de. Brady. fue. muy. buena. La. casa. de. Brady. y. Malinda. es. muy. agradable. ordenada. y. limpia. tal. cual. se. ve. en. las. im. genes. La. ubicaci. n. es. excelente. para. nosotros. la. mas. linda. de. la. ciudad. , . Pudimos. cruzarnos. solo. un. dia. con. Brady. y. nos. ayudo. mucho. en. como. manejarnos. en. la. ciudad. con. los. transportes. igualmente. nos. escribimos. por. la. aplicaci. n. constantemente. por. cualquier. duda. que. ten. amos. siempre. muy. amable. Con. Malinda. no. pudimos. conocernos. pero. fue. muy. atenta. con. nosotros. un. d. a. que. llov. a. mucho. nos. dejo. una. nota. y. un. paraguas. en. la. mesa. Gracias. por. abrirnos. sus. puertas. , Graciano. y. Julieta. ",es,"Our.be.to.in.it.from.Brady.it was.very.good.The.House.from.Brady.Y.Malindais.very.nice.OrderY.clean.such.which.I know.go.in.the.IMGenesThe.locationn.is.Excellent.for.us.the.more.beautiful.from.the.town..We could.Cross us.only.a.day.with.Brady.Y.us.helped.much.in.What.Handlein.the.town.with.the.transportation.equally.us.we wrote.for.the.Applicationn.constantly.for.any.doubt.that.have.mastersforever.very.kind.With. Malinda.no.we could.know each other.but.it was.very.Attentivewith.us.a.d.to.that.LLOV.to.much.us.left.a.note.Y.a.umbrella.in.the.desk.Thank you.for.Open us.their.doors., GracianoY.Julieta."
513,7194793,75351250,2016-05-20,48761219,Vane, Habernos. hospedado. en. el. hogar. de. Brady. y. Melinda. fue. la. mejor. decisi. n. que. tomamos. en. nuestro. viaje. a. Boston. En. primer. lugar. Brady. y. Melinda. son. excelentes. personas. y. grandes. anfitriones. Fueron. muy. amables. y. nos. ayudaron. con. toda. la. informaci. n. que. necesitamos. para. nuestra. visita. a. la. ciudad. El. departamento. es. muy. acogedor. con. una. decoraci. n. bonita. bien. cuidada. y. agradable. La. habitaci. n. es. muy. confortable. y. luminosa. y. se. ve. que. sus. due. os. est. n. atentos. a. los. detalles. El. barrio. es. excelente. Muy. seguro. y. muy. bien. ubicado. para. acceder. desde. l. a. los. mejores. restaurantes. y. paseos. tur. sticos. El. check. in. out. del. departamento. fue. muy. sencillo. gracias. a. las. indicaciones. de. Brady. quien. de. una. manera. muy. pr. ctica. nos. facilit. el. proceso. Todo. lo. que. imdica. el. aviso. est. reflejado. en. la. realidad. Definitivamente. volver. amos. a. hospedarnos. en. el. hogar. de. Brady. ya. que. todo. lo. que. hay. en. l. hace. que. la. estad. a. supere. las. expectativas. Gracias. por. todo. Brady. y. Melinda. ,es,Have us. Hosted. in. the. home. from. Brady. Y. Melinda. it was. the. better. Decision. n. that. we take. in. our. trip. to. Boston. In. first. place. Brady. Y. Melinda. are. Excellent persons. Y. big. hosts They were. very. kind Y. us. They helped. with. all. the. Information n. that. we need. for. our. visit. to. the. town. The Department. is. very. cozy. with. a. decoration n. pretty. good. Careful Y. nice. The. habitation n. is. very. comfortable. Y. Luminous. Y. I know. go. that. their. Due you. its T. n. Attentive to. the. details. The neighborhood. is. Excellent. Very. sure. Y. very. good. located. for. to access. from. l. to. the. top. restaurants. Y. Walks Tur Picture The. Check. In. out. of. Department. it was. very. simple. Thank you. to. the. indications. from. Brady. who. from. a. manner. very. PR CICTA us. Facilit. the. process. Everything. it. that. Imdication the. warning. its T. reflected in. the. reality. Definitely. return. masters to. Hosting us. in. the. home. from. Brady. already. that. everything. it. that. there are. in. l. does. that. the. be. to. Super the. expectations. Thank you. for. everything. Brady. Y. Melinda.
514,7194793,79154762,2016-06-11,6424431,Carina," Aardige. mensen. die. we. niet. veel. gezien. hebben. omdat. ze. s. nachts. werkten. We. konden. keuken. en. zitkamer. gebruiken. De. kamer. is. prettig. met. een. goed. bed. en. een. heerlijk. balkon. Iets. meer. ruimte. voor. onze. spullen. was. fijn. geweest. , De. buurt. is. erg. leuk. met. eettentjes. en. winkels. dichtbij. en. op. looptijd. van. metro. maar. ook. van. bezienswaardigheden. ",nl,"Nice.people.That.we.not.a lot.seen.to have.because.she.s.at night.worked.We.Could.kitchen.and.Lounge.use.The.room.is.Nice.of.a.Good.bed.and.a.lovely.balcony.Something.Lake.room.for.our.stuff.used to be.fine.been., The.neighbourhood.is.terribly.fun.of.Eatters.and.stores.close to.and.on.duration.by.subway.but.also.by.sights."
515,7194793,86504055,2016-07-16,52240440,Paulo, Local. previlegiado. limpo. e. charmoso. Cama. e. len. is. para. se. sentir. em. casa. Que. bom. ter. um. casal. simp. tico. como. Melinda. e. Brady. para. nos. oferecer. essa. possibilidade. de. hospedagem. na. maravilhosa. Boston. ,pt,Place.previleged.clean.and.charming.Bed.and.Len.is.for.If.to feel.in.House.What.Good.to have.a.couple.Yes P.Tico.like.Melinda.and.Brady.for.US.to offer.That.possibility.in.accommodation.at.Wonderful.Boston.
516,77691,515913,2011-09-09,970901,Ruby, . Airbnb. ,zh-cn,.Airbnb.
517,77691,581513,2011-09-29,1120910,Andreas," Es. war. mein. erstes. AIRBNB. Erlebnis. und. ich. kann. sagen. das. es. besser. eigentlich. nicht. kommen. konnte. Ich. hatte. ein. sch. nes. Zimmer. mit. in. dem. Haus. das. neben. gutem. TV. auch. K. che. Bad. etc. hatte. war. ein. zweiter. Mieter. Hermine. ist. ausserordentlich. freundlich. und. gastfreundlich. Der. Stadtteil. ist. nicht. der. allerbeste. aber. sicher. und. nah. an. der. Redline. man. kommt. immer. berall. hin. , Andreas",de,"It.was.my.First.Airbnb.Adventure.and.I.can.to say.that. It.better.actually.not.come.could.I.had.one.Sch.NES.Room.With.by doing.House.that. Next.Good.TV.also.K. Che.Bath.etc. had.was.one.Second.Renter.Hermione.is.Extraordinary.friendly.and.Hospitable.The.District.is.not.the.Best of all.but.secure.and.close.on.the.Redline.Man.comes.always.Hydration.there., Andreas"
518,77691,6051145,2013-07-28,7063270,Hsun-Chih, nice. room,pl,nice. room
519,77691,7980569,2013-10-11,8215807,Jacques, Hermina. tr. s. tes. agr. able. Toujours. r. ceptive. aux. soucis. que. nous. pouvions. avoir. toujours. pr. te. rendre. URL. HIDDEN. maison. est. grande. Notre. chambre. etait. spacieuse. ,fr,Hermina.tr.s.your.AGR.Able.Always.r.Ceptive.to.worry.than.we.could.to have.always.pr.you.return.URL.Hidden.House.is.big.Our.bedroom.was.Spacious.
520,77691,19290988,2014-09-09,14325032,Clémence, La. nuit. s. est. bien. pass. e. Appartement. tr. s. bien. situ. chambre. agr. able. Hermina. s. est. montr. e. tr. s. disponible. pour. r. pondre. nos. questions. et. organiser. notre. venue. ,fr,The night.s.is.Good.Pass.e.Apartment.tr.s.Good.if you.bedroom.AGR.Able.Hermina.s.is.show.e.tr.s.available.for.r.lay.NOS.Questions.and.to organise.our.come.
521,77691,20030879,2014-09-22,20452541,Hope, Perfect. memorize. ,zh-cn,Perfect. memorize.
522,77691,21980881,2014-10-27,3779793,Júlia," Fue. muy. sencillo. encontrar. la. casa. con. las. indicaciones. de. Herminia. est. muy. cerca. del. metro. y. llegar. al. centro. de. la. ciudad. es. r. pido. Donna. lo. mejor. de. la. estancia. es. muy. amable. y. nos. resolvi. todas. las. dudas. La. habitaci. n. es. igual. que. en. las. im. genes. amplia. y. limpia. El. nico. problema. es. que. se. escuchan. bastante. los. ruidos. de. los. dem. s. inquilinos. de. la. casa. , Se. puede. usar. la. cocina. y. por. la. ma. ana. Donna. nos. invit. a. desayunar. con. caf. fruta. fresca. y. pan. Muy. recomendable. para. quedarse. en. Boston. ",es,"It was.very.simple.meet.the.House.with.the.indications.from.Herminiaits T.very.near.of.meter.Y.arrive.to the.center.from.the.town.is.r.I ask.Donnait.better.from.the.stay.is.very.kind.Y.us.Resolvi.all.the.Doubts.The.habitationn.is.same.that.in.the.IMGenesWide.Y.clean.The. Nico.trouble.is.that.I know.they listen.Quite.the.Noises.from.the.Dems.Tenantsfrom.the.House., I know.may.use.the.kitchen.Y.for.the.MAAna.Donnaus.inviteto.eat breakfast.with.CAF.fruit.FreshY.bread.Very.recommendable.for.to stay.in.Boston."
523,77691,32928240,2015-05-23,30643420,Christos, INsgesamt. sehr. sch. ne. Unterkunft. und. ein. ger. umiges. Zimmer. dass. nicht. nur. mit. dem. N. tigsten. ausgestattet. ist. Die. K. che. kann. man. tats. chlich. sinnvoll. nutzen. falls. man. das. m. chte. da. Dinge. wie. l. oder. Gew. rze. die. man. nicht. unbedingt. f. r. einmal. Kochen. kaufen. m. chte. vorhanden. sind. W. rmstens. weiterzuempfehlen. ,de,All in all.very.Sch.ne.Accomodation.and.one.Ger.Umige.Room.that. Not.only.With.to the.N. Teststen.fitted.is.The.K. Che.can.Man.Tat.sensible.to use.if.Man.That. M. Che.there.Things.how.l.or.Wel. Rze.the.Man.not.necessarily.f. r.once.Cook.to buy.m. Che.present.are.W. RMSTENS.to recommend.
524,77691,33307812,2015-05-26,33150574,Huiting, . ,zh-cn,.
525,77691,38794581,2015-07-18,38442649,Mateo, Muy. bonita. casa. en. un. barrio. no. tan. lejano. del. centro. ,es,Very.pretty.House.in.a.neighborhood.no.so.far.of.center.
526,77691,41847902,2015-08-09,29964823,Yuqi, . ,zh-cn,.
527,77691,50774224,2015-10-14,43304785,Ling Chun, . ,ko,.
528,77691,90835135,2016-08-02,14077593,Lisa, Tr. s. bon. s. jour. Boston. La. maison. est. c. t. du. m. tro. ce. qui. est. positif. Hermina. a. t. tr. s. disponible. Je. recommande. ,fr,Tr. S.Well.s.day.Boston.The House.is.vs.t.from.m.Tro.this.Who.is.positive.Hermina.at.t.tr.s.available.I.recommended.
529,77691,93173720,2016-08-11,76596519,Christophe, Quartier. moyen. sans. charme. Maison. sans. charme. chambre. ultra. basique. pas. de. clim. bruyante. A. cot. de. la. police. locale. certes. s. curisant. mais. gyrophares. et. bruits. de. radio. toutes. les. nuits. sous. la. fen. tre. dommage. les. photos. donnaient. l. impression. d. une. maison. traditionnelle. Bostonienne. on. en. est. loin. ,fr,Piece.Medium.without.charm.House.without.charm.bedroom.ultra.basic.not.of.CLIM.noisy.A. Cot.of.the.police.local.certainly.s.Current.corn.Gyrophares.and.Noises.of.radio.all.the.Nights.under.the.Fen.to be.shame.the.Pictures.gave.L.impression.d.a.House.traditional.BOSTONIAN.we.in.is.far.
530,5146447,34263893,2015-06-06,12830076,Rodrigo, Sarah. es. muy. buena. anfitriona. la. habitaci. n. es. perfecta. para. el. viaje. es. cercana. al. centro. de. la. ciudad. lo. que. es. muy. importante. mi. paso. fue. muy. tranquilo. no. escuche. nada. de. ruido. y. pude. descansar. muy. bien. ,es,Sarahis.very.good.hostess.the.habitationn.is.Perfectfor.the.trip.is.closeto the.center.from.the.town.it.that.is.very.important.me.He passed.it was.very.calm.no.I listened.any.from.noise.Y.I could.to rest.very.good.
531,5146447,37025941,2015-07-03,37259604,Lina, Solo. nos. quedamos. una. noche. No. nos. sentimos. seguros. en. el. barrio. quiz. porque. llegamos. muy. tarde. y. aunque. Sarah. estaba. muy. pendiente. de. los. mensajes. no. la. conocimos. ,es,Only.us.We are left.a.night.No.We feel.Insurancein.the.neighborhood.Quizbecause.we arrived.very.late.Y.even if.Sarahshe was.very.earring.from.the.posts.no.the.We met.
532,5146447,38903830,2015-07-19,10179505,Pillias," La. communication. avec. Sarah. via. airBnb. c. est. effectu. sans. encombre. Nous. avons. galement. pu. la. croiser. peu. apr. s. notre. arriv. , . , Les. lieux. correspondent. bien. aux. photos. pr. sent. s. sur. le. site. , Il. y. a. galement. un. lave. vaisselle. appr. ciable. ainsi. qu. un. PC. dispo. sur. place. , . , Cependant. la. propret. reste. d. sir. cuisine. un. peu. crasseuse. po. le. collante. cheveux. qui. traine. sous. les. lits. dans. la. douche. dans. les. coins. Baignoire. crasseuse. ect. , Manque. galement. un. peu. de. mat. riel. pour. cuisiner. po. le. fouet. r. cipient. et. un. grille. pain. ",fr,"Communication.with.Sarah.via.Airbnb.vs.is.carried out.without.enclose.We.have.Also.could.the.cross.little.APR.s.our.arrivals.,., The.premises.correspondGood.to.Pictures.pr.feel.s.on.the.site., He.y.at.Also.a.wash.washing up.appr.cable.so.that.a.PC.Available.on.square.,., However.the.properet.rest.d.Sir.food.a.little.filthy.PO.the.Sticky.hair.Who.dragged.under.the.Beds.in.the.shower.in.the.corners.Bathtub.filthy.ect., Lack.Also.a.little.of.mast.Riel.for.to cook.PO.the.whisk.r.Cipient.and.a.gate.bread."
533,5146447,49033390,2015-09-30,43155177,Frank, Sarah. Sarah. Dudley. Station. Ruggles. ,zh-cn,Sarah. Sarah. Dudley. Station. Ruggles.
534,8988506,71748793,2016-04-28,66469540,Jean Michel, Nous. avons. pass. un. excellent. s. jour. Boston. dans. ce. magnifique. appartement. Il. est. tr. s. bien. plac. 30. minutes. du. centre. ville. pied. Un. tr. s. beau. supermarch. est. proximit. avec. des. plats. cuisin. s. et. un. self. service. pour. se. faire. des. salades. la. URL. HIDDEN. y. a. aussi. une. station. v. lib. proximit. pour. se. d. placer. viter. la. voiture. Boston. les. parkings. sont. extr. mement. chers. 22. dollars. 1. h. ou. 38. pour. une. nuit. ,fr,We.have.Pass.a.excellent.s.day.Boston.in.this.magnificent.apartment.He.is.tr.s.Good.Placement.30 minutes.from.center.city.foot.A TR.s.beautiful.Supermarch.is.Proximity.with.from.dishes.Cuisin.s.and.a.Self.service.for.SE.To do.from.Salads.the.URL.Hidden.y.at.Also.a.station.v.Lib.Proximity.for.SE.d.to place.Viter.the.car.Boston.the.parkings.are.Extr..Dear.22. Dollars.1. h.Where.38. For.a.night.
535,8988506,78853886,2016-06-09,72265053,Enrique J., Excelente. departamento. confortable. muy. bien. decorado. y. totalmente. equipado. Todo. funcion. bien. Superamos. un. mal. entendido. con. el. uso. de. llaves. Esperamos. en. vano. a. Josh. una. ma. ana. y. nos. arreglamos. solos. Muy. buena. ubicaci. n. no. c. ntrica. aunque. a. 5. minutos. del. centro. caminando. El. market. contiguo. es. muy. pr. ctico. Totalmente. recomendable. ,es,Excellent.Department.comfortable.very.good.decorated.Y.completely.equipped.Everything.function.good.We surpass.a.evil.understood.with.the.use.from.keys.We wait.in.vain.to.Josha.MAAna.Y.us.We arrange.Solo.Very.good.locationn.no.c.NTRICA.even if.to.5 minutes.of.center.walking.The. Market.adjacent.is.very.PRCTICOCompletely.recommendable.
536,8988506,90132600,2016-07-31,77971525,Marc," Tr. s. belle. r. sidence. visible. d. s. le. hall. d. accueil. Appartement. de. grand. standing. machines. laver. s. che. linge. piscine. Proximit. commerces. , Seul. probl. me. bruits. engendr. s. par. les. travaux. l. ext. rieur. mais. l. h. te. avait. pr. venu. ",fr,"Tr. S.beautiful.r.SIDE.visible.d.s.the.lobby.d.homepage.Apartment.of.big.Standing.machines.wash.s.chess.laundry.pool.Proximity.businesses., Only.problem.me.Noises.Engendr.s.through.the.works.L.ext.laughing.corn.L.h.you.had.pr.came."
537,894539,78191852,2016-06-05,15977288,Pierre-Osias," Jennifer. nous. a. tr. s. bien. re. u. on. s. est. senti. l. aise. d. s. le. d. but. Le. premier. soir. elle. est. venue. avec. nous. pour. nous. faire. d. couvrir. les. commerces. avoisinants. , . , Le. quartier. ou. elle. habite. est. plaisant. calme. et. s. curitaire. On. peut. facilement. se. rendre. au. centre. ville. en. prenant. un. autobus. et. un. m. tro. pour. un. total. d. environ. quarante. minutes. au. plus. , . , La. chambre. correspondait. la. description. ",fr,"Jennifer.we.at.tr.s.Good.D.u.we.s.is.felt.L.easy.d.s.the.d.goal.The.first.evening.she.is.come.with.we.for.we.To do.d.cover.the.businesses.Surrounding.,., The.piece.Where.she.reside.is.pleasant.calmed down.and.s.Curricular.We.can.easily.SE.return.to.center.city.in.Taking.a.bus.and.a.m.Tro.for.a.total.d.about.forty.minutes.to.more.,., Bedroom.corresponded.the.description."
538,4119345,86715092,2016-07-17,69298092,Juan, . ,zh-cn,.
539,9840919,79081044,2016-06-11,15437940,Anna Maria, Con. mio. marito. abbiamo. soggiornato. 3. notti. in. questo. appartamento. nella. prima. met. di. giugno. E. un. grazioso. appartamento. arredato. con. bei. mobili. in. un. contesto. gradevole. di. case. vittoriane. La. zona. abbastanza. tranquilla. e. comoda. ha. una. metropolitana. a. 10. minuti. a. piedi. Ci. sono. vari. negozi. e. locali. nei. pressi. Carino. il. living. la. cucina. un. po. essenziale. Il. bagno. un. po. troppo. piccolo. molto. minimale. Letto. comodo. in. una. stanza. spaziosa. Non. abbiamo. incontrato. l. host. ma. abbiamo. comunicato. via. email. Unico. inconveniente. stato. il. rumore. persistente. proprio. fuori. dalla. finestra. della. camera. da. letto. che. le. prime. due. notti. soprattutto. la. seconda. non. ci. ha. permesso. di. dormire. bene. Abbiamo. scritto. alla. proprietaria. che. ha. provveduto. immediatamente. e. l. ultima. sera. siamo. riusciti. a. riposare. ,it,With.my.husband.we have.Stayed.3 nights.in.this.apartment.in the.first.Met.from.June.It's a.Pretty.apartment.furnished.with.EIB.mobile.in.a.context.Pleasant.from.homes.Victorian.Area.enough.calm.And.Convenient.has.a.subway.to.10 minutes.to.feet.There.I am.Various.shops.And.locals.in the.Press.Cute.the.Living.there.kitchen.a.bit.essential.The bathroom.a.bit.too.small.very.minimal.Bed.comfortable.in.a.room.Spacious.We do not have.encountered.L.Host.but.we have.Press release.Street.e-mail.One of a kind.Increased.state.the.noise.persistent.own.out.from the.window.from the.room.from.read.that.the.Prime.two.Nights.above all.there.second.not.there.has.permit.from.sleep.well.We have.written.at the.owner.that.has.provided.immediately.And.L.Last.evening.are.Successful.to.rest.
540,6554785,39411640,2015-07-23,35911223,Guillaume, Tout. tait. parfait. Nous. sommes. aller. du. 21. au. 23. juillet. 2015. Appartement. tr. s. propre. Ned. tais. disponible. pour. r. pondre. nos. questions. En. plain. centre. ville. id. al. pour. tout. faire. pied. Je. le. recommande. ,fr,All.tait.perfect.We.are.go.from.21. At.23. July.2015. Apartment.tr.s.own.NED.TAIS.available.for.r.lay.NOS.Questions.In.Plain.center.city.ID.Al.for.all.To do.foot.I.the.recommended.
