,listing_id,id,date,reviewer_id,reviewer_name,comments,review_lang,t_comments
245,4609785,47750025,2015-09-21,3779009,Gisella," Camera. spaziosa. e. tranquilla. con. moquette. sul. pavimento. e. un. po. anonima. nell. arredo. Letto. grande. e. comodo. Purtroppo. non. c. un. armadio. dove. mettere. i. vestiti. perch. quello. presente. nella. camera. era. pieno. , Il. bagno. era. pulito. , Anna. vive. nell. appartamento. ed. una. ragazza. tranquilla. e. disponibile. , Il. recupero. delle. chiavi. stato. facile. e. siamo. potuti. rimanere. nell. appartamento. fino. a. tardo. pomeriggio. perch. avevamo. l. aero. la. sera. , Boston. una. piccola. citt. e. tutto. facilmente. raggiungibile. piedi. con. una. passeggiata. per. arrivare. in. centro. calcolare. circa. 30min. Numerosi. ristoranti. nella. zona. ",it,"Room.Spacious.And.calm.with.Carpet.on the.floor.And.a.bit.Anonymous.in the.furniture.Bed.great.And.comfortable.Unfortunately.not.c.a.wardrobe.where is it.put.the.clothes.Whythat.present.in the.room.was.full., The bathroom.was.cleaned up., Anna.she lives.in the.apartment.and.a.lass.calm.And.available., The. Recovery.from the.keys.state.easy.And.are.Potuous.to remain.in the.apartment.until.to.late.afternoon.WhyWe had.L.Aero.there.evening., Boston.a.small.CityAnd.everything.easily.reachable.feet.with.a.walk.for.arrive.in.center.to calculate.about.30min.Numerous.Restaurants.in the.area."
246,8310653,73633631,2016-05-09,48314082,Jesica, Chenkai. nos. recibi. con. mucha. cordialidad. y. simpat. a. Nos. ayud. en. lo. que. necesit. bamos. La. habitaci. n. es. muy. grande. y. c. moda. y. la. ubicaci. n. es. muy. conveniente. ya. que. solo. est. s. a. 2. cuadras. del. T. que. te. deja. en. el. centro. La. zona. tiene. movimiento. tambi. n. Solo. recuerden. que. el. ba. o. es. compartido. la. limpieza. no. es. perfecta. ,es,Chenkai.us.I received.with.a lot.cordiality.Y.Simpat.to.We help.in.it.that.Need.let's go.The.habitationn.is.very.big.Y.c.fashion.Y.the.locationn.is.very.convenient.already.that.only.its T.s.to.2 blocks.of.T.tea.let.in.the.center.The.zone.has.movement.Tambin.Only.Rememberthat.the.BA.or.is.shared.the.cleaning.no.is.Perfect
247,8310653,76231861,2016-05-25,61482519,Jose, Se. trata. de. un. barrio. accesible. en. tranv. a. y. con. comercios. en. la. proximidad. de. la. casa. Shashank. dispuso. para. nosotros. informaci. n. de. utilidad. wifi. etc. El. apartamento. es. amplio. y. nos. encontramos. muy. c. modos. en. l. Tuvimos. la. suerte. de. poder. hacer. uso. de. l. en. exclusiva. ,es,I know.about.from.a.neighborhood.accessible.in.tramto.Y.with.shops.in.the.proximity.from.the.House.Shashank.He arranged.for.us.Informationn.from.utility.Wifi.etc.Apartment.is.large.Y.us.we find.very.c.Modesin.l.We had.the.luck.from.can.do.use.from.l.in.Exclusive
248,9107357,74753548,2016-05-16,29500720,Pablo," El. departamento. fue. muy. bueno. en. todo. sentido. Muy. amplio. y. practico. para. hacer. de. una. vida. mucho. mas. relajada. que. en. un. hotel. , El. barrio. es. impresionante. tal. cual. se. describe. y. super. bien. ubicado. Cerca. de. todo. como. para. caminar. , . , ",es,"The Department.it was.very.Okay.in.everything.sense.Very.large.Y.practical.for.do.from.a.life.much.more.Relaxed.that.in.a.hotel., The neighborhood.is.Awesome.such.which.I know.Describe.Y.Super.good.located.Near.from.everything.What.for.walk..,"
249,6677640,37995542,2015-07-12,27225880,Kai," Die. Organisation. mit. Patrick. und. die. bergabe. der. Wohnung. waren. einfach. Patricks. Wohnung. war. sehr. sch. n. sauber. und. komplett. ausgestattet. perfektes. WLAN. Es. war. wie. der. Besuch. bei. einem. Freund. der. gerade. nicht. zu. Hause. ist. Danke. , Die. Lage. ist. zentral. wenige. Minuten. zu. Fu. zum. Boston. Common. und. in. die. Altstadt. Das. Haus. und. die. Stra. e. waren. ruhig. Wenige. H. user. weiter. gibt. es. im. Supermarkt. alles. zu. kaufen. was. man. im. Urlaub. braucht. au. erdem. Gastronomie. Wer. mit. dem. Auto. anreist. kann. sein. Gep. ck. in. die. Wohnung. bringen. und. dann. in. ein. Parkhaus. fahren. Patrick. hat. uns. gute. Tipps. gegeben. , Wir. haben. uns. sehr. wohl. gef. hlt. , Wenn. wir. nochmal. nach. Boston. reisen. w. rden. wir. versuchen. wieder. bei. Patrick. zu. wohnen. ",de,"The.Organization.With.Patrick.and.the.Default.the.Apartment.was.simple.Patricks.Apartment.was.very.Sch.n. clean.and.completely.fitted.Perfect.WIRELESS INTERNET ACCESS.It.was.how.the.Visit.at.One.Friend.the.just.not.to.Home.is.Thank you., The.Position.is.central.few.Minutes.to.FU.to the.Boston.Common.and.in the.Old town.The.House.and.the.Street.e.was.quiet.Few.H. User.further.are.it.in the.Supermarket.everything.to.to buy.What.Man.in the.Holidays.needs.Au.First of all.Gastronomy.Who.With.to the.Automobile.Arrest.can.being.Gep.CK.in the.Apartment.bring.and.then.In. On.Parking garage.drive.Patrick.has.US.quality.Tips.given., We.to have.US.very.well.Gef.Hft., When.weather.once again.after.Boston.journeys.w. Rden.weather.to attempt.again.at.Patrick.to.reside."
250,4107959,33014962,2015-05-24,2143828,Caroline," Nous. avons. t. tr. s. bien. re. us. chez. Paul. L. appartement. est. tr. s. propre. confortable. et. bien. situ. Paul. est. tr. s. accueillant. discret. gentil. et. accommodant. , Nous. retournerons. chez. Paul. sans. la. moindre. h. sitation. , Merci. ",fr,"We.have.t.tr.s.Good.D.US.at the house of.Paul.L. apartment.is.tr.s.own.comfortable.and.Good.if you.Paul.is.tr.s.welcoming.discreet.kind.and.accommodating., We.will return.at the house of.Paul.without.the.less.h.., Thank you."
251,4107959,81773312,2016-06-25,73616678,Ingrid, Die. Lage. der. Wohnung. ist. f. r. einen. Besuch. Bostons. sehr. g. nstig. Wir. haben. uns. bei. Paul. sehr. wohl. gef. hlt. der. ein. sehr. freundlicher. und. interessanter. Gastgeber. ist. Wir. w. rden. zu. jeder. Zeit. wiederkommen. ,de,The.Position.the.Apartment.is.f. r.a.Visit.Bostons.very.G.Native.We.to have.US.at.Paul.very.well.Gef.Hft.the.one.very.Friendly.and.more interesting.Host.is.We.w. Rden.to.everyone.Time.come back.
252,2547075,81357987,2016-06-22,45455216,Maria Del Mar, Location. is. excellent,fr,Location. is. excellent
253,11579622,68768784,2016-04-06,58702952,Wataru," . , . BnB. , . 1. ",ja,". , . BnB. , . 1."
254,11579622,77634976,2016-06-02,3648477,Moritz, Jess. und. Will. sind. freundliche. und. kommunikative. Gastgeber. Die. Unterkunft. liegt. nahe. des. Flughafens. im. lateinamerikanischen. Viertel. Beim. Check. In. gab. es. leider. ein. paar. Missverst. ndnisse. Dennoch. geeignet. f. r. eine. Nacht. vor. Hin. oder. R. ckflug. ,de,Jess.and.Want.are.Friendly.and.Communicative.Host.The.Accomodation.located.vicinity.of the. Airport.in the.Latin American.Quarter.At the.Check.In.gave.it.Unfortunately.one.pair.Missed.Narrow.Yet.suitable.f. r.one.Night.before.There.or.R. CK.
255,11579622,90110540,2016-07-31,42478527,YuanYuan, . ,zh-cn,.
256,11579622,94720711,2016-08-16,18534271,Marc, Zeeer. vuile. en. vettig. appartement. vriendelijkheid. was. ondermaats. blijkbaar. alleen. maar. om. het. geld. te. doen. Eigenlijk. zouden. dit. soort. verhuurders. van. de. lijst. moeten. geschrapt,nl,Vehicle.Dirty.and.greasy.apartment.friendliness.used to be.below par.evidently.only.but.to.the.money.at.to do.Actually.would.this.kind.Landlords.by.the.list.must.deleted
257,3615760,50138750,2015-10-09,20014418,超," . , 1. 20. , 2. , 3. , 4. ",zh-cn,". , 1. 20. , 2. , 3. , 4."
258,11122394,94070589,2016-08-14,81468666,Patrick, L. appartement. est. tr. s. beau. avec. une. superbe. terrasse. L. appartement. est. tr. s. bien. equip. et. tr. s. spacieux. Quartier. tr. s. central. dans. Boston. et. logement. proximit. du. m. tro. Accueil. tr. s. personnalis. et. chaleureux. avec. beaucoup. de. disponibilit. et. d. attentions. de. la. part. de. l. h. te. Un. must. ,fr,L. apartment.is.tr.s.beautiful.with.a.Superb.Terrace.L. apartment.is.tr.s.Good.EQUIP.and.tr.s.spacious.Piece.tr.s.central.in.Boston.and.lodging.Proximity.from.m.Tro.Homepage.tr.s.Customized.and.warm.with.many.of.AVAILABILITY.and.d.attentions.of.the.go.of.L.h.you.A must.
259,10524612,73659541,2016-05-09,34152476,思远, . ,zh-cn,.
260,10524612,82776550,2016-06-29,79766169,Louison, Super. H. te. disponible. appartement. propre. spacieux. et. pratique. Le. m. tro. est. 5. minutes. de. marche. pour. rejoindre. le. centre. ville. de. Boston. La. literie. est. confortable. Tr. s. bon. s. jour. Je. recommande. vivement. le. logement. ,fr,Great.H. TE.available.apartment.own.spacious.and.convenient.The.m.Tro.is.5 minutes.of.market.for.to rejoin.the.center.city.of.Boston.The bedding.is.comfortable.Tr. S.Well.s.day.I.recommended.strongly.the.lodging.
261,10524612,96298101,2016-08-22,12929724,Giulio," L. alloggio. si. trova. al. piano. terra. di. una. palazzina. di. tre. piani. abbiamo. trovato. le. chiavi. in. un. box. protetto. da. codice. L. appartamento. ordinato. e. funzionale. con. due. camere. da. letto. la. prima. ha. un. letto. king. mentre. la. seconda. queen. ma. ad. ogni. modo. ci. si. pu. dormire. in. due. , La. zona. ok. prettamente. residenziale. senza. troppi. ristornati. Per. raggiungere. il. centro. per. basta. davvero. una. fermata. di. metro. necessaria. per. perch. occorre. passare. sotto. al. mare. ci. troviamo. infatti. in. un. altra. penisola. Per. andare. alla. fermata. occorrono. meno. di. 5. min. a. piedi. , Shawn. stato. disponibile. e. ci. ha. permesso. di. stare. qualche. ora. in. pi. nell. appartamento. il. giorno. della. partenza. ",it,"L. Accommodation.Yes.finds.to the.plan.Earth.from.a.Palazzina.from.three.plans.we have.found it.the.keys.in.a.box.Protected.from.code.The apartment.tidy.And.functional.with.two.Rooms.from.read.there.first.has.a.read.King.while.there.second.Queen.but.to.every.way.there.Yes.PU.sleep.in.two., Area.OK.purely.residential.without.too many.Ristorted.For.to reach.the.center.for.enough.really.a.stop.from.meter.Necessary.for.WhyIt is necessary.pass.under.to the.sea.there.We find.indeed.in.a.other.peninsula.For.to go.at the.stop.They are needed.less.from.5. min.to.feet., Shawn.state.available.And.there.has.permit.from.to stay.some.Now.in.Pi.in the.apartment.the.day.from the.departure."
262,11618815,87487122,2016-07-20,10712235,Audrey, James. est. venu. tr. s. gentiment. nous. chercher. l. a. roport. malgr. notre. vol. retard. L. appartement. est. tr. s. propre. avec. d. adorables. animaux. Il. est. galement. tr. s. bien. situ. 1. station. de. m. tro. du. centre. de. Boston. et. 1. station. de. l. a. roport. Des. p. tisseries. et. des. fruits. nous. ont. t. propos. s. pour. le. petit. dejeuner. James. est. disponible. en. cas. de. question. mais. sait. aussi. rester. tr. s. discret. Bref. une. 1e. exp. rience. Airbnb. qui. s. est. tr. s. bien. pass. e. ,fr,James.is.came.tr.s.kindly.we.to look for.L.at.ROPORT.Malga.our.flight.delay.L. apartment.is.tr.s.own.with.d.adorable.animals.He.is.Also.tr.s.Good.if you.1. Station.of.m.Tro.from.center.of.Boston.and.1. Station.of.L.at.ROPORT.From.p.Tisseries.and.from.fruits.we.have.t.about.s.for.the.small.to eat lunch.James.is.available.in.case.of.question.corn.knows.Also.to stay.tr.s.discreet.Short.a.1E.EXP.riches.Airbnb.Who.s.is.tr.s.Good.Pass.e.
263,8325477,51350387,2015-10-19,13574312,Stéphanie, Jeffrey. est. un. h. te. agr. able. et. accueillant. qui. a. su. tre. disponible. avant. mais. galement. durant. le. s. jour. L. appartement. est. tr. s. propre. bien. quip. et. surtout. id. alement. situ. Tout. se. trouve. proche. de. l. appartement. une. distance. raisonnable. Id. al. pour. d. couvrir. la. ville. Je. n. h. siterai. pas. faire. appel. Jeffrey. pour. un. prochain. s. jour. ,fr,Jeffrey.is.a.h.you.AGR.Able.and.welcoming.Who.at.su.to be.available.before.corn.Also.during.the.s.day.L. apartment.is.tr.s.own.Good.who P.and.above all.ID..if you.All.SE.find.close.of.L.apartment.a.distance.reasonable.Id. Al.for.d.cover.the.city.I.not.h.SITERAI.not.To do.call.Jeffrey.for.a.next.s.day.
264,2246959,32352640,2015-05-17,26753825,Piedad," Perfecta. ubicaci. n. Muy. bien. dotado. El. sof. cama. no. es. c. modo. pero. las. camas. son. muy. buenas. Vecindario. muy. tranquilo. Con. el. aire. tuvimos. problemas. pero. abrimos. las. ventanas. y. el. tema. de. calor. se. solucion. Lo. recomiendo. muy. bien. para. dos. parejas. , ",es,"Perfectlocationn.Very.good.gifted.The. Sof.bed.no.is.c.mode.but.the.Beds.are.very.good.Neighborhood.very.calm.With the.air.We had.problems.but.We open.the.Windows.Y.the.theme.from.heat.I know.solution.It.I recommend.very.good.for.two.couples,"
265,2246959,46962257,2015-09-14,41769880,Maria, El. departamento. tiene. una. excelente. ubicacion. Esta. muy. bien. cerca. de. restaurantes. tiendas. puedes. caminar. a. todas. partes. Si. volveria. a. quedarme. ahi. ,es,The Department.has.a.Excellent.location.Is.very.good.near.from.restaurants.stores.can.walk.to.all.PartsYes.I would return.to.Stay.there.
266,2246959,96589118,2016-08-23,54090492,Jim, All. was. good,so,All. was. good
267,586994,31028354,2015-05-01,24070000,Stefan," Der. Kontakt. zu. Maggie. war. sehr. freundlich. informativ. und. angenehm. Sie. antwortet. meist. umgehend. Vor. Ort. hat. mich. ein. Bekannter. von. ihr. in. Empfang. genommen. und. die. Wohnung. gezeigt. der. ebenfalls. freundlich. war. , . , Das. Appartment. liegt. in. einem. gediegenen. Appartmentbuilding. in. perfekter. Lage. am. Boston. Common. in. Beacon. Hill. Man. ist. quasi. Gast. im. Boston. State. Haus. Die. U. Bahn. Station. Park. Street. ist. 250. Meter. entfernt. Im. Haus. nebenan. ist. ein. kleiner. Supermarkt. In. direkter. Umgebung. sind. mehrere. Restaurants. Bars. Kaffees. und. weitere. Superm. rkte. , . , Zum. Fenuil. Markt. sind. es. z. B. gut. 10. Minuten. zu. Fuss. zum. New. England. Aqarium. keine. 20. Minuten. Zu. Macy. s. dauert. es. gut. 5. Minuten. zum. Beginn. der. Newburry. Street. einmal. durch. den. Park. und. damit. etwa. gute. 10. Minuten. das. Prudential. Center. oder. die. Public. Library. d. rften. keine. 20. Minuten. entfernt. sein. , . , Das. Appartment. besteht. im. wesentlichen. aus. einem. Raum. dazu. Abstellkammer. und. Bad. Es. hat. wertigen. Parkettboden. berhaupt. ist. das. gesamte. Geb. ude. in. gutem. wertigem. Zustand. und. verf. gt. ber. einen. Portier. Sicherheitsdienst. Im. Appartment. ist. ALLES. selbst. B. geleisen. brett. Wasserkocher. Kaffeemaschine. Toaster. 4. fach. Herd. Ofen. Mirko. kr. ftiger. K. hlschrank. Besteck. Geschirr. Sp. laschine. TV. DVD. Player. klasse. Internet. per. W. LAN. usw. was. man. an. N. tzlichkeiten. und. Annehmlichkeiten. braucht. vorhanden. direkt. auf. dem. Flur. gibt. es. Waschmaschine. und. Trockner. Dazu. kommen. Details. wie. ein. BRITA. Tischwasserfilter. Das. Bad. ist. sehr. komfortabel. und. gen. gend. gro. Es. hat. ein. eigenes. Fenster. Der. ABSOLUTE. KN. LLER. ist. die. Dachterrasse. mit. PERFEKTEM. Blick. ber. Boston. , . , Das. Appartment. ist. f. r. 1. Person. oder. 1. P. rchen. geeignet. wenn. es. auch. nicht. viel. kleiner. sein. d. rfte. , . , Ich. hatte. in. Boston. eine. wirklich. tolle. Zeit. und. w. rde. gerne. wiederkommen. Sowohl. nach. Boston. als. auch. in. Maggies. Appartment. ",de,"The. Contact. to. Maggie. was. very. friendly. informative. and. pleasant. She. Answer. most of time. immediately. In front. Location. has. me. one. Known. from. her. in. Reception. taken. and. the. Apartment. shown. the. Likewise. friendly. was. ,. , The. Apartment. located. in. One. Dignified. Apartmentbuilding. in. Perfect. Position. Am. Boston. Common. in. Beacon. Hill. Man. is. so to say. Guest. in the. Boston. State. House. The. Subway. Station. Park. Street. is. 250. meters. removed. Im. House. next door. is. one. smaller. Supermarket. In. Direct. Surroundings. are. several. Restaurants. Bars. Coffee. and. Further. Superm. RKT. ,. , To the. Fenuil. Market. are. it. z. B. Good. 10 mins. to. Foot. to the. New. England. Aqarium. none. 20 minutes. To. Macy. s. takes. it. Well. 5 minutes. to the. Beginning. the. Newburry. Street. once. through. the. Park. and. in order to. about. quality. 10 mins. That. Prudential. Center. or. the. Public. Library. d. Rften. none. 20 minutes. removed. being. ,. , The. Apartment. consists. in the. essentially. out. One. Space. to. Storage room. and. Bath. It. has. Value. Parquet floor. Major. is. the entire. Geb. Ude. in. Good. Valentic. Status. and. Author. Gt. Ber. One. Porter. Security service. Im. Apartment. is. EVERYTHING. Even. B. dishes. board. Water heater. Coffee machine. Toaster. 4. Tray. Stove. Oven. Mirko. kr. Fucker. K. bar cabinet. Cutlery. Dishes. Sp. Mooring. TV. DVD. Player. class. Internet. by. WIRELESS INTERNET ACCESS. etc. What. Man. on. North. and. Amenities. needs. present. direct. on. to the. Hallway. are. it. Washing machine. and. Dryer. In addition. come. Details. how. one. Brita. Table water filter. The. Bath. is. very. comfortable. and. gene. Gend. Great. It. has. one. Own. Window. The. ABSOLUTE. CN. Ler. is. the. Roof terrace. With. Perfect. View. Ber. Boston. ,. , The. Apartment. is. f. r. 1st person. or. 1. P. Rchen. suitable. if. it. also. not. a lot. smaller. being. d. Renten. ,. , I. had. in. Boston. one. really. great. Time. and. w. Rde. gladly. come back. As well as. after. Boston. as. also. in. Maggies. Apartment."
268,586994,31641531,2015-05-08,28815352,Magda, El. lugar. era. perfecto. queda. muy. bien. ubicado. a. una. cuadra. de. la. estaci. n. de. metro. y. caminando. se. llega. a. varios. lugares. de. inter. s. al. lado. del. Boston. Common. el. Public. garden. Quincy. market. Faneuil. Hall. y. caminando. hasta. a. 20. min. de. Prudential. El. espacio. es. de. un. tama. o. ideal. para. 2. limpio. es. verdad. que. esta. en. la. ciudad. pero. de. noche. es. muy. silencioso. Maggie. fue. muy. amable. y. nos. dejo. poner. nuestro. equipaje. antes. de. la. hora. de. check. in. solo. estoy. muy. apenada. porque. yo. olvide. la. instrucci. n. final. que. ella. me. dio. a. la. hora. del. check. out. The. place. is. perfect. for. 2. the. location. is. great. 1. block. from. subway. station. and. you. can. walk. to. a. lot. of. nearest. places. like. boston. common. public. garden. faneuil. Hall. quincy. market. copley. square. 20. min. walking. to. prudential. center. etc. The. apartment. was. very. clean. and. confortable. We. arrived. before. the. check. in. hour. and. Maggie. was. waiting. for. us. i. m. just. so. sad. because. i. forgot. the. instruction. that. she. gave. us. for. the. check. out. We. are. very. sorry. but. that. ,es,The place. it was. perfect. is left over. very. good. located. to. a. block. from. the. station. n. from. meter. Y. walking. I know. arrives. to. various. places. from. inter. s. to the. side. of. Boston. Common. the. Public. garden. Quincy. Market. Faneuil. Hall. Y. walking. until. to. 20. min. from. Prudential. Space. is. from. a. tama. or. ideal. for. 2. clean. is. truth. that. is. in. the. town. but. from. night. is. very. silent. Maggie. it was. very. kind. Y. us. left. set. our. Baggage. before. from. the. hour. from. check. in. only. I'm. very. sorry. because. me. I forgot. the. instruction. n. final. that. her. I. gave. to. the. hour. of. check. out. The. place. is. perfect. For. 2. the. location. is. great. 1. block. desde. subway. station. and. you. dog. walk. to. to. lot. of. nearest. places. like. boston. common. public. garden. faneuil. Hall. quincy. Market. copley. square. 20. min. walking. to. Prudential. center. etc. The. apartment. was. look and. clean. and. comfortable. We. arrived. before. the. check. in. hour. and. Maggie. was. waiting. For. us. i. m. just. SW. sad. because. i. forgot. the. instruction. that. she. Gave. us. For. the. check. out. We. are. look and. sorry. but. that.
269,586994,32879040,2015-05-23,26209476,Miguel Elías, Me. estaban. esperando. a. la. hora. acordada. Excelente. trato. y. paciencia. La. publicaci. n. se. corresponde. con. la. realidad. Es. un. monoambiente. con. todas. las. comodidades. Cocina. ropa. blanca. utensilios. Apto. para. dos. personas. El. lugar. es. c. ntrico. El. condominio. es. seguro. y. tranquilo. Excelente. opci. n. ,es,I.They were.waiting.to.the.hour.AgreedExcellent.treatment.Y.patience.The.Publicationn.I know.correspondswith.the.reality.Is a.Stunningwith.all.the.mod cons.Kitchen.clothing.White.Utensils.Apt to.two.persons.The place.is.c.N.The condominium.is.sure.Y.calm.Excellent.OPCIn.
270,586994,45234232,2015-09-01,27013443,Liliana Silvia, Me. senti. muy. comoda. porque. era. tal. cual. lo. que. yo. URL. HIDDEN. ubicacion. era. excelente. y. la. entrega. del. depto. fue. tal. cual. lo. habiamos. planeado. Todo. en. el. depto. funcionaba. la. vigilancia. estuvo. alli. todo. el. tiempo. aunque. el. vecindario. era. sumamente. seguro. ,es,I.Senti.very.comfortable.because.it was.such.which.it.that.me.URLHidden.location.it was.Excellent.Y.the.delivery.of.Dept.it was.such.which.it.We had.plannedEverything.in.the.Dept.It worked.the.surveillance.he was.there.everything.the.weather.even if.the.neighborhood.it was.extremely.sure.
271,586994,48980254,2015-09-30,27397869,Ulrike," Wir. hatten. zu. zweit. einen. sehr. sch. nen. dreiw. chigen. Aufenthalt. in. Boston. Die. Lage. des. Apartments. war. ideal. f. r. Stadtspazierg. nge. zu. Fu. und. Ausfl. ge. etwa. mit. der. U. Bahn. Wundervoll. war. die. Dachterrasse. mit. Blick. ber. die. Parkanlagen. und. die. Skyline. Das. Haus. ist. sehr. gepflegt. die. Nachbarn. sind. freundlich. distanziert. Uns. wurde. trotz. versp. teter. Ankunft. am. Abend. alles. freundlich. erkl. rt. und. gezeigt. Die. Wohnung. enthielt. alles. n. tige. ein. zweiter. Stuhl. w. re. nicht. schlecht. gewesen. etwa. beim. Essen. am. Tisch. , Wir. haben. uns. sehr. wohl. gef. hlt. und. werden. uns. gern. an. unsere. Zeit. in. Boston. erinnern. , ",de,"We.had.to.second.a.very.Sch.NEN.ThreeW.cherigen.Stay.in. Boston.The.Position.of the. Apartments.was.ideal.f. r.City skill.NGE.to.FU.and.ExternalGe.about.With.the.Subway.Wonderful.was.the.Roof terrace.With.View.Ber. The.Parking equipment.and.the.Skyline.The.House.is.very.groomed.the.Neighbours.are.friendly.distant.US.would.in spite of.ConventionTee.Arrival.in the evening.everything.friendly.Earl.RT.and.shown.The.Apartment.contained.everything.n. Tigen.one.Second.Chair.w. Re.not.bad.been.about.at the.Meal.at the table., We.to have.US.very.well.Gef.Hft.and.will.US.gladly.on.our.Time.in. Boston.remember.,"
272,586994,77776160,2016-06-03,57888333,Anne, Maggie. est. une. h. te. tr. s. agr. able. la. prise. de. contact. avec. elle. a. t. tr. s. facile. L. appartement. est. tr. s. propre. et. correspond. en. tout. point. la. description. sur. le. site. La. terrasse. qu. on. aper. oit. sur. les. images. n. est. pas. mentionn. e. dans. le. descriptif. alors. que. c. est. un. atout. incroyable. avec. une. vue. magnifique. sur. Boston. et. la. State. House. La. situation. est. tr. s. central. ce. qui. nous. a. permis. de. tout. faire. pied. J. y. retourne. demain. ,fr,Maggie.is.a.h.you.tr.s.AGR.Able.the.socket.of.contact.with.she.at.t.tr.s.easy.L. apartment.is.tr.s.own.and.corresponds.in.all.point.the.description.on.the.site.The terrace.that.we.AVERAGEILO.on.the.Images.not.is.not.mentioned.e.in.the.Description.so.than.vs.is.a.asset.incredible.with.a.view.magnificent.on.Boston.and.the.State.House.The situation.is.tr.s.central.this.Who.we.at.permit.of.all.To do.foot.J. Y.return.tomorrow.
273,586994,94477480,2016-08-15,33299927,Maurus, Ein. wunderbarer. Aufenthalt. an. bester. Lage. in. Boston. Die. Wohnung. war. etwas. kleiner. als. erwartet. 1. Raum. plus. Badezimmer. jedoch. sauber. und. praktisch. eingerichtet. Maggie. hat. stets. sehr. schnell. und. hilfreich. kommuniziert. und. alles. daf. r. getan. dass. unser. Aufenthalt. gut. wird. Wir. k. nnen. die. Wohnung. sehr. empfehlen. ,de,A.Wonderful.Stay.on.best.Position.in. Boston.The.Apartment.was.something.smaller.as.expected.1. room.plus.Bathroom.However.clean.and.practical.furnished.Maggie.has.always.very.fast.and.helpful.communicates.and.everything.DAF.r.did.that. Our.Stay.Well.will.We.k.n.the.Apartment.very.recommend.
274,13584884,97530948,2016-08-27,71452000,Marie, Die. Wohnung. bzw. das. Zimmer. ist. wie. beschrieben. wirklich. sch. n. Wir. durften. alles. mitverwenden. und. Liz. und. ihre. Mitbewohnerin. Lauren. waren. super. nett. und. zuvorkommend. Die. Lage. ist. auch. toll. mit. dem. Bus. ist. man. in. 10. Minuten. beim. Harvard. Square. wo. es. Gesch. fte. und. nette. Restaurants. und. Caf. s. gibt. sowie. eine. U. Bahnstation. Wir. hatten. eine. tolle. Zeit. bei. Liz. und. haben. uns. sehr. wohl. gef. hlt. Vielen. Dank. ,de,The.Apartment.or that. room.is.how.described.really.Sch.n. We.were allowed.everything.How to use.and.Liz.and.their.Flatmate.Lauren.was.great.kind.and.courteous.The.Position.is.also.Great.With.to the.Bus.is.Man.in 10 minutes.at the.Harvard.Square.Where.it.Gesch.FTE.and.Nice.Restaurants.and.CAF.there are.such as.one.Metro station.We.had.one.great.Time.at.Liz.and.to have.US.very.well.Gef.Hft.Many.Thanks to.
275,12233285,88670926,2016-07-25,84793620,Alexia, Bon. s. jour. chez. Ricardo,fr,Good.s.day.at the house of.Ricardo
276,12233285,89227129,2016-07-27,76898825,Robert," Hatten. nur. Kontakt. ber. Airbnb. Alles. wurde. per. Mail. besprochen. und. hat. sehr. gut. geklappt. Hatten. ein. Zimmer. und. den. Rest. zur. Mitbenutzung. mit. den. anderen. G. sten. also. eigentlich. keine. komplette. Unterkunft. , Soweit. war. aber. alles. gut. und. gut. organisiert. ",de,"Had.only.Contact.Ber. Airbnb.Everything.would.by.Mail.discussed.and.has.very.Well.succeeded.Had.one.Room.and.the.Rest. To.Swiss usage.With.the.others.G. sten.so.actually.none.Complete.Accomodation., So far.was.but.everything.Well.and.Well.organized."
277,12233285,90210398,2016-07-31,78460291,송이, . ,ko,.
